Name,Slug,Collection ID,Item ID,Created On,Updated On,Published On,Дата прописью,Сегодня в музее,Короткое описание,Описание программы,Превью,Обложка,Картинка,Цвет фона,Цвет текста,Добавит несколько фотографий
ДЕНЬ РОЖДЕНИЯ КОМПОЗИТОРА,prazdnichnaya-programma,63e507244eda1e713c4c7d34,662763187e6b5d252e8f3837,Tue Apr 23 2024 07:28:24 GMT+0000 (Coordinated Universal Time),Wed May 08 2024 10:13:44 GMT+0000 (Coordinated Universal Time),Wed May 08 2024 10:13:44 GMT+0000 (Coordinated Universal Time),7 мая 2024,false,,"<h5 id="""">План мероприятий в День рождения П. И. Чайковского 7 мая 2024 год</h5><p id="""">‍</p><h4 id="""">11.00 - Возложение цветов к памятнику П. И. Чайковского у Троицкого собора </h4><h4 id="""">12.00 - Возложение цветов к памятнику П. И. Чайковского в Музее-заповеднике</h4><h4 id="""">12.00, 14.00, 16.00 - Исполнение произведений Чайковского на мемориальном рояле композитора в кабинете-гостиной лауреатами международных конкурсов</h4><h4 id="""">13.00 - Лекция «Милые, любимые, дорогие» (для сборных групп)</h4><h4 id="""">14.00, 15.00 - Обзорная экскурсия по мемориальному комплексу (для сборных групп)</h4><h4 id="""">14.00 - Детская игровая программа «Шагаем с Чайковским» на террасе Детского центра</h4><h4 id="""">15.00 Мастер-класс «Цветы для Чайковского»</h4><h4 id="""">‍</h4><h4 id="""">В течение дня - Квесты «Кто украл меч Орлеанской Девы?», «Как звали собаку Чайковского?» по экспозиции «Чайковский. Симфония «Жизнь» (самостоятельно)</h4><p id="""">‍</p><h5 id=""""><em id="""">Посещение экспозиций и выставок концертно-выставочного комплекса без экскурсионного обслуживания - бесплатно.</em></h5><p id="""">‍</p><h4 id="""">Концерт 5 МАЯ <a href=""https://www.tchaikovsky.house/afisha/koncert-dnyu-rozhdeniya-p-i-chaykovskogo-posvyashchaetsya-m-fedotov-skripka-g-petrova-fortepiano-6"" id="""">ДНЮ РОЖДЕНИЯ ЧАЙКОВСКОГО ПОСВЯЩАЕТСЯ </a></h4><h5 id="""">‍</h5><p id="""">‍</p><p id="""">‍</p>",https://uploads-ssl.webflow.com/63e507244eda1ee9bb4c7ccd/66276a1c5f050ab5fd4c236e_1%D0%B4%D0%B5%D0%BD%D1%8C%20%D1%80%D0%BE%D0%B6%D0%B4%D0%B5%D0%BD%D0%B8%D1%8F.jpg,https://uploads-ssl.webflow.com/63e507244eda1ee9bb4c7ccd/6628e001ef8b03291c13f74d_%D0%B4%D0%B5%D0%BD%D1%8C%20%D1%80%D0%BE%D0%B6%D0%B4%D0%B5%D0%BD%D0%B8%D1%8F%20%D0%BF%D1%80%D0%BE%D0%B3%D1%80%D0%B0%D0%BC%D0%BC%D0%B0.jpg,https://uploads-ssl.webflow.com/63e507244eda1ee9bb4c7ccd/66276a1c5f050ab5fd4c236e_1%D0%B4%D0%B5%D0%BD%D1%8C%20%D1%80%D0%BE%D0%B6%D0%B4%D0%B5%D0%BD%D0%B8%D1%8F.jpg,,#e1223c,
«Ротбарт- похититель Рождества»,rotbart-pohititel-rozhdestva,63e507244eda1e713c4c7d34,63e7a3ea8c0997c326ab4bd3,Sat Feb 11 2023 14:19:22 GMT+0000 (Coordinated Universal Time),Fri Mar 17 2023 06:40:58 GMT+0000 (Coordinated Universal Time),Fri Mar 17 2023 06:48:04 GMT+0000 (Coordinated Universal Time),с 16 декабря 2022 по 15 января 2023,false,Детская экскурсионная программа 6+,"<h4 id="""">Детская экскурсионная программа 6+</h4><p id="""">‍</p><p id="""">Запутанная детективная история с элементами квеста для &nbsp;школьников младших классов. Расследуя её, ребята узнают много интересного, вступят в борьбу со злым волшебником, разбудят заколдованную Музу и спасут праздник.</p><p id="""">На новогодние праздники &nbsp;в гости пригласили Музу Мельпомену — покровительницу театра. Но злой волшебник Ротбарт, персонаж балета «Лебединое озеро», решил испортить торжество и усыпил её. Те из участников программы, кто найдёт и отгадает загадки Ротбарта, сможет разбудить Музу и тогда праздник состоится.</p><p id="""">Дети познакомятся с &nbsp;традициями празднования Рождества и Нового года в России и в семье Петра Ильича Чайковского. Трогательные детские впечатления нашли позднее своё отражение в сказочном рождественском балете-феерии «Щелкунчик» ­­– это подготовка всей семьёй к празднику; рождественская ёлка, наряженная старинными игрушками; ожидание чуда, волшебства и подарков. Всех гостей программы тоже ждут &nbsp;рождественские подарки, &nbsp;в том числе музыкальные: популярное развлечение &nbsp;XIX века – «Волшебный фонарь» и, пожалуй, самый главный рождественский подарок – чарующее звучание рояля композитора.</p><p id="""">‍</p><p id=""""><strong>Программа проводится по предварительным заявкам по телефонам:</strong></p><p id="""">+7 915-110-43-38, +7 (49624) 2-10-50.</p><p id="""">‍</p><blockquote id="""">В &nbsp;дни новогодних праздников организуются сборные группы:<br><br>05.01.2023 г. – 14.00<br>06.01.2023 г. – 12.00<br>07.01.2023 г. – 14.00<br>08.01.2023 г. – 14.00</blockquote><p id="""">‍</p><p id=""""><strong id="""">Продолжительность программы 90 мин.</strong></p><p id=""""><strong id="""">Стоимость: взрослый – 1300 руб., льготный – 1150 руб.</strong></p><p id="""">‍</p>",https://uploads-ssl.webflow.com/63e507244eda1ee9bb4c7ccd/64140b71976598c9c39f2723_Frame%2040295.webp,https://uploads-ssl.webflow.com/63e507244eda1ee9bb4c7ccd/63e7a3dc60afc2719390ee67_%D1%80%D0%BE%D1%82%D0%B1%D0%B0%D1%80%D1%82.webp,,,,
Удивительный мир балета,udivitelnyy-mir-baleta,63e507244eda1e713c4c7d34,63e7a9534bd9074ae5bf07e7,Sat Feb 11 2023 14:42:27 GMT+0000 (Coordinated Universal Time),Fri Mar 31 2023 10:58:22 GMT+0000 (Coordinated Universal Time),Fri Mar 31 2023 10:58:37 GMT+0000 (Coordinated Universal Time),с 22 января по 26 марта,false,"Цикл из 9 занятий для учащихся начальных и средних классов познакомит школьников с искусством классического балета, поможет им стать грамотными зрителями музыкального театра.","<h4 id="""">Цикл из 9 занятий &nbsp;для &nbsp;учащихся начальных и средних классов познакомит &nbsp;школьников с искусством классического балета, поможет им стать грамотными зрителями музыкального театра.</h4><p>‍</p><blockquote id="""">22, 29 января в 14.00; 5, 12, 19 февраля в 14.00; 5, 12, 19, 26 марта в 14.00</blockquote><p id="""">‍</p><p id="""">Хотите узнать, что такое балет, как передать характер и эмоции без слов? &nbsp;Кто трудится над созданием балета? &nbsp;Как стать настоящей балериной? &nbsp;Сколько метров ткани нужно, чтобы сшить красивую юбку-пачку для танца? &nbsp;Зачем туфельки балерины помещают в печь?</p><p id="""">Приходите на наши воскресные занятия, и мы ответим на все ваши вопросы. Вы узнаете об искусстве балета, истории его возникновения и развития, научитесь понимать классическую музыку и условный язык танца. Вместе &nbsp;мы «отправимся в театр» и &nbsp;познакомимся с шедеврами классических постановок различных театров, с прославленными мастерами &nbsp;искусства классического танца.</p><p id="""">‍</p><h5 id="""">Расписание занятий:</h5><p id="""">‍</p><p id="""">22 января в 14.00 История возникновения и развития балетного искусства.</p><p id="""">29 января в 14.00 С. Прокофьев «Золушка».</p><p id="""">5 февраля в 14.00 Л. Делиба «Коппелия».</p><p id="""">12 февраля в 14.00 П. Чайковский «Щелкунчик».</p><p id="""">19 февраля в 14.00 П. Чайковский «Лебединое озеро».</p><p id="""">5 марта в 14.00 П. Чайковский «Спящая красавица».</p><p id="""">12 марта в 14.00 И. Стравинский «Жар-птица».</p><p id="""">19 марта в 14.00 В. Купцов «Аленький цветочек».</p><p id="""">26 марта в 14.00 Заключительное занятие. Викторина.</p><p id="""">‍</p><p id=""""><strong id="""">Продолжительность каждого занятия: 60 мин.</strong></p><p id="""">‍</p><p id=""""><strong id="""">Предварительная запись по телефону 8-903- 715-92-23</strong></p><p id="""">‍</p>",https://uploads-ssl.webflow.com/63e507244eda1ee9bb4c7ccd/641352566d775855af83b133_%D0%BC%D0%B8%D1%80%20%D0%B1%D0%B0%D0%BB%D0%B5%D1%82%D0%B0.webp,https://uploads-ssl.webflow.com/63e507244eda1ee9bb4c7ccd/63e7a94ff173057c49f103c4_%D0%BC%D0%B8%D1%80-%D0%B1%D0%B0%D0%BB%D0%B5%D1%82%D0%B0.webp,https://uploads-ssl.webflow.com/63e507244eda1ee9bb4c7ccd/641419e2eb11794082f2f593_Frame%2040297.png,"hsla(201.64948453608247, 60.25%, 31.57%, 1.00)",,
Праздничные программы,v-novogodnie-kanikuly,63e507244eda1e713c4c7d34,657181be88651712f0840799,Thu Dec 07 2023 08:26:38 GMT+0000 (Coordinated Universal Time),Mon Jan 15 2024 06:36:47 GMT+0000 (Coordinated Universal Time),Mon Jan 15 2024 06:36:47 GMT+0000 (Coordinated Universal Time),13 и 14 января,false,,"<figure id="""" class=""w-richtext-figure-type-image w-richtext-align-center"" data-rt-type=""image"" data-rt-align=""center""><div id=""""><img src=""https://uploads-ssl.webflow.com/63e507244eda1ee9bb4c7ccd/657182f0eaee09aef74cd760_%D1%81%D0%BA%D0%B0%D0%B7%D0%BA%D0%B8.jpg"" loading=""lazy"" id="""" width=""auto"" height=""auto"" alt=""""></div></figure><h5 id=""""><strong id="""">Детская игровая программа «Сказки играют в прятки» (6 - 10 лет)</strong></h5><p id="""">Помогите сказочному герою ""собрать разбежавшиеся сказки""! &nbsp;</p><p id="""">Побывайте в мемориальном доме, послушайте звучание старинного рояля. Предметы интерьера дома Чайковского помогут вам угадать двадцать русских и зарубежных сказок. Назвав&nbsp;все сказки, вы получите особенный подарок : ""Волшебный фонарь"" - популярное развлечение XIX века. </p><p id="""">А на выставке «Музыкальные сказки» вы познакомитесь с известными мультфильмами и их героями. Затем вас ждут игры, конкурсы, танцы и новогодний сувенир.</p><figure id="""" class=""w-richtext-figure-type-image w-richtext-align-center"" data-rt-type=""image"" data-rt-align=""center""><div id=""""><img src=""https://uploads-ssl.webflow.com/63e507244eda1ee9bb4c7ccd/657183a988651712f085600a_%D0%BE%D0%B4%D0%B8%D1%81%D1%81%D0%B5%D1%8F.jpg"" loading=""lazy"" id="""" width=""auto"" height=""auto"" alt=""""></div></figure><p id="""">‍</p><h5 id="""">""Новогодняя одиссея Чайковского"" (взрослые, школьники средних и старших классов)</h5><p id="""">Вы совершите увлекательное путешествие в прошлое и познакомитесь с традициями празднования Рождества и Нового года в России и в странах, в которых бывал П. И. Чайковский. </p><p id="""">Соберемся у большого обеденного стола и сыграем в веселую народную игру. В мемориальном доме гостей ждет уникальное развлечение XIX века – ""Волшебный фонарь, а также чарующее звучание старинного рояля.</p><p>‍</p><h4 id=""""><strong><em id="""">Программы для групп проводятся по предварительной записи </em></strong></h4><p></p><h4 id=""""><em>8 (49624) 2-10-50; 8 (915) 110-43-38</em></h4><p id="""">‍</p>",https://uploads-ssl.webflow.com/63e507244eda1ee9bb4c7ccd/6571819164d9b6827202170c_photo_5440866916081193091_y.jpg,,https://uploads-ssl.webflow.com/63e507244eda1ee9bb4c7ccd/6572d289f3436b9d4b06aa09_photo_5447580731648889521_y.jpg,#e1223c,,
Вернисаж,vernisazh-k-85-letiyu-so-dnya-rozhdeniya-eleny-obrazcovoy,63e507244eda1e713c4c7d34,66471860f8395e1e7147f0a9,Fri May 17 2024 08:42:08 GMT+0000 (Coordinated Universal Time),Wed May 22 2024 06:08:48 GMT+0000 (Coordinated Universal Time),Wed May 22 2024 06:08:48 GMT+0000 (Coordinated Universal Time),21 мая,false,,"<h5 id="""">21 мая ""Вернисаж"" к 85-летию со дня рождения Елены Образцовой</h5><p id="""">‍</p><p id="""">18.00 - Торжественное открытие выставки </p><p id="""">18.30 - Музыкальное приношение лауреатами Международного конкурса молодых оперных певцов Елены Образцовой</p><p id="""">‍</p><p id="""">Елизавета Кулагина (сопрано)</p><p id="""">Владимир Дмитрук (тенор)</p><p id="""">Елизавета Дмитриева (фортепиано)</p>",,https://uploads-ssl.webflow.com/63e507244eda1ee9bb4c7ccd/6644baecaed57485efd751bd_unnamed.jpg,https://uploads-ssl.webflow.com/63e507244eda1ee9bb4c7ccd/6647194d2c946410894d7b50_rq0eTXZiizo.jpg,,,
Виртуальный концертный зал (январь 2023),virtualnyy-koncertnyy-zal,63e507244eda1e713c4c7d34,63e7a8c73f7127eba33033ba,Sat Feb 11 2023 14:40:07 GMT+0000 (Coordinated Universal Time),Thu Mar 16 2023 18:29:01 GMT+0000 (Coordinated Universal Time),Fri Mar 17 2023 06:48:04 GMT+0000 (Coordinated Universal Time),с 17 по 31 января,false,Репертуар виртуального концертного зала на январь.,"<h4>Репертуар виртуального концертного зала на январь.</h4><p>‍</p><p id=""""><strong id="""">17 января в 14.00</strong></p><p id="""">Большой симфонический оркестр. Владимир Федосеев, дирижер.</p><p id="""">В ПРОГРАММЕ:</p><p id="""">П.И. Чайковский. Симфония № 1. Симфония № 6.</p><p id=""""> </p><p id=""""><strong id="""">21 января в 14.00</strong></p><p id="""">Государственный академический симфонический оркестр им. Светланова. Василий Синайский, дирижер. Вокальный ансамбль «Intrada». Константин Шушаков, баритон. Марина Ребека, сопрано. Айгуль Ахметшина, меццо-сопрано. Алексей Неклюдов, тенор. Олег Цибулько, бас. Мария Горцевская, меццо-сопрано. Александра Саульская-Шелятьева, меццо-сопрано, Ярослав Абаимов, тенор. Даниил Чесноков, бас.</p><p id="""">В ПРОГРАММЕ:</p><p id="""">П.И. Чайковский. «Евгений Онегин» (опера в концертном исполнении).</p><p id=""""> </p><p id=""""><strong id="""">24 января в 14.00</strong></p><p id="""">Денис Мацуев, фортепиано. Российский национальный молодежный симфонический оркестр. Валентин Урюпин, дирижер. Ярослав Тимофеев, ведущий.</p><p id="""">В ПРОГРАММЕ:</p><p id="""">П.И. Чайковский. Увертюра-фантазия «Ромео и Джульетта».</p><p id="""">С.В. Рахманинов. Концерт № 3для фортепиано с оркестром ре минор, соч. 30.</p><p id=""""> </p><p id=""""><strong id="""">28 января в 14.00</strong></p><p id="""">Российский национальный молодежный симфонический оркестр. Даниэль Райскин, дирижер. Борис Березовский, фортепиано.</p><p id="""">В ПРОГРАММЕ:</p><p id="""">П.И. Чайковский. Фрагменты из музыки балета «Щелкунчик».</p><p id="""">С.В. Рахманинов. Концерт № 2для фортепиано с оркестром до минор, соч. 18.</p><p id="""">П.И. Чайковский. Сюита из музыки балета «Лебединое озеро» (редакция Д. Райскина).</p><p id=""""> </p><p id=""""><strong id="""">31 января в 14.00</strong></p><p id="""">Борис Березовский, фортепиано. Национальный филармонический оркестр России. Калле Куусава, дирижер. Российский национальный молодежный симфонический оркестр. Михаил Юровский, дирижер.</p><p id="""">В ПРОГРАММЕ:</p><p id="""">П.И. Чайковский. Концертная фантазия для фортепиано с оркестром соль мажор, соч. 56.</p><p id="""">П.И. Чайковский. Симфония № 5 ми минор, соч.64.</p><p id=""""> </p><p id=""""><strong id=""""><em id="""">ВХОД ПО БИЛЕТАМ В МУЗЕЙ.</em></strong></p><p>‍</p>",https://uploads-ssl.webflow.com/63e507244eda1ee9bb4c7ccd/64135e2d0218e77f0f1659e2_%D1%80%D0%B5%D0%BF%D0%B5%D1%80%D1%82%D1%83%D0%B0%D1%80%20%D0%B2%D0%B8%D1%80%D1%82.png,https://uploads-ssl.webflow.com/63e507244eda1ee9bb4c7ccd/63e7a8a854ac2ea1b9691abd_%D0%B2%D0%B8%D1%80%D1%82%D1%83%D0%B0%D0%BB%D1%8C%D0%BD%D1%8B%D0%B8%CC%86-%D0%B7%D0%B0%D0%BB-%E2%80%94-.webp,,,,
