Name,Slug,Collection ID,Item ID,Created On,Updated On,Published On,Дата прописью,Сегодня в музее,Короткое описание,Описание программы,Превью,Обложка,Картинка,Цвет фона,Цвет текста,Добавит несколько фотографий
1 ИЮНЯ - ДЕНЬ ЗАЩИТЫ ДЕТЕЙ,1-iyunya---den-zashchity-detey,63e507244eda1e713c4c7d34,6655efae55b266d9fad46e40,Tue May 28 2024 14:52:30 GMT+0000 (Coordinated Universal Time),Mon Jun 03 2024 06:55:33 GMT+0000 (Coordinated Universal Time),Mon Jun 03 2024 06:55:33 GMT+0000 (Coordinated Universal Time),1 июня 2024,false,,"<h5>11.00 - мастер-класс ""Ландыш серебристый"" 200 руб. </h5><h5>12.30 и 14.00 - мастер-класс ""Браслет своими руками"" 200 руб.</h5><h5>14.00 - выступление хореографического отделения КДШИ им. П. И. Чайковского на террасе Детского центра</h5><h5>15.00 - экскурсия ""В гости к Чайковскому"" (бесплатно)</h5><h5>16.00 - Концерт ""Музыки чарующие звуки"" (по входным билетам в музей) и награждение победителей конкурса детского рисунка ""Чайковские. СемьЯ"" в концертном зале музея-заповедника </h5><p>‍</p>",,,https://uploads-ssl.webflow.com/63e507244eda1ee9bb4c7ccd/6655efab6f0802777cbc7b3d_image-28-05-24-01-59-4.jpeg,,,
1 июня – День защиты детей.,1-iyunya-den-zashchity-detey,63e507244eda1e713c4c7d34,6477222adbe6933ceb286655,Wed May 31 2023 10:32:10 GMT+0000 (Coordinated Universal Time),Tue Jun 13 2023 06:27:10 GMT+0000 (Coordinated Universal Time),Tue Jun 13 2023 06:27:16 GMT+0000 (Coordinated Universal Time),01 июня,false,1 июня – День защиты детей.,"<p id=""""><strong id="""">1 июня – День защиты детей.</strong></p><p id=""""><strong id="""">&nbsp;</strong></p><p id=""""><strong id="""">12.00 – Путешествие по музейным дорожкам &nbsp; 6+</strong></p><p id=""""><strong id="""">&nbsp;</strong></p><p id="""">Игровая программа проводится в парке музея - заповедника П.И. Чайковского.&nbsp; Дети познакомятся с историей поселения композитора в Клину. Школьникам помогут разобраться, что такое ледник, флигель, каретный сарай. Научат играть в старинные игры: болото, серсо и городки. Ребятам предстоит выполнить увлекательные задания, сложить из букв слово-подсказку, чтобы получить приз.</p><p id=""""><strong id="""">&nbsp;</strong></p><p id=""""><strong id="""">14.00 – Фоторамка своими руками &nbsp; 6+</strong></p><p id=""""><strong id="""">&nbsp;</strong></p><p id="""">Под руководством музейных специалистов дети самостоятельно изготовят фоторамку, декорированную в технике парчмент крафт. Фоторамка станет хорошим подарком родным и друзьям или сувениром на память.</p><p id=""""><strong id="""">&nbsp;</strong></p><p id=""""><strong id=""""><em id="""">Предварительная запись по телефонам:&nbsp; +7 (49624) 2-10-50, +7-915-110-43-38</em></strong></p><p id=""""><br></p><p>‍</p>",https://uploads-ssl.webflow.com/63e507244eda1ee9bb4c7ccd/64772224ffaac4bc160981be_1%D0%B8%D1%8E%D0%BD%D1%8F.webp,https://uploads-ssl.webflow.com/63e507244eda1ee9bb4c7ccd/6477219a1c8570b22615ec67_Group%2028045.webp,https://uploads-ssl.webflow.com/63e507244eda1ee9bb4c7ccd/6477247ae0f4dc148b130eaf_Layer%201.webp,"hsla(46.49214659685863, 88.84%, 57.84%, 1.00)","hsla(60, 1.64%, 11.96%, 1.00)",
7 мая – День рождения П.И. Чайковского,7-maya-den-rozhdeniya-p-i-chaykovskogo,63e507244eda1e713c4c7d34,64526636853ec8495da670d9,Wed May 03 2023 13:48:38 GMT+0000 (Coordinated Universal Time),Wed May 10 2023 13:42:20 GMT+0000 (Coordinated Universal Time),Wed May 10 2023 13:42:49 GMT+0000 (Coordinated Universal Time),7 мая 2023,false,7 мая – День рождения П.И. Чайковского,"<h4 id=""""><strong id="""">Возложение цветов к памятнику П.И. Чайковского – 12.00</strong></h4><h4 id=""""><strong id="""">В течение дня звучит мемориальный рояль П. И. Чайковского.</strong></h4><p id=""""><em id="""">&nbsp;</em></p><p id=""""><strong id=""""><em id="""">Экскурсии для сборных групп:</em></strong></p><p id=""""><strong id="""">11.00 – Чайковский – история успеха</strong>. </p><p id="""">Интерактивная экскурсия по экспозиции «Чайковский. Симфония «Жизнь» расскажет о становлении великого композитора, о сложном пути, который прошёл он от беспечного юноши-правоведа до известного во всём мире композитора и дирижёра. Каким было первое образование Чайковского, что удивляло его за границей, достаточно ли родиться талантливым, чтобы добиться успеха? Ответы на эти и многие другие вопросы можно получить во время экскурсии. </p><p id="""">Стоимость – <strong id="""">200 руб./чел.</strong></p><p id="""">&nbsp;</p><p id=""""><strong id="""">12.00 – Обзорная экскурсия по музею-заповеднику. </strong></p><p id="""">В экскурсию включено: посещение дома композитора, с полностью сохранившейся подлинной обстановкой 19 века; звучание в записи рояля П.И. Чайковского; прогулка по мемориальному парку, посещение выставок из фондов музея-заповедника.</p><p id="""">Стоимость – <strong id="""">350 руб./чел.</strong></p><p id="""">&nbsp;</p><p id=""""><strong id="""">14.00 – Обзорная экскурсия по мемориальному комплексу. </strong></p><p id="""">В экскурсию включено: посещение дома композитора, с полностью сохранившейся подлинной обстановкой 19 века; звучание в записи рояля П.И. Чайковского; прогулка по мемориальному парку</p><p id="""">Стоимость ­– <strong id="""">350 руб./чел.</strong></p><p id=""""><strong id="""">&nbsp;</strong></p><p id=""""><strong id="""">15.00 – Обыкновенные гости необыкновенного дома.</strong> </p><p id="""">Театрализованная экскурсия по дому композитора, где сохранилась подлинная обстановка, поможет посетителям погрузиться в атмосферу 19 века, творческую и бытовую жизнь великого композитора. Ожившие персонажи – гости необыкновенного дома – расскажут о его привычках и привязанностях, о распорядке дня и укладе жизни в тихом, уютном доме на окраине Клина, о котором сам Чайковский писал: «Мне дома хорошо, и заниматься я нигде не могу с такими удобствами, как здесь».</p><p id="""">Стоимость – <strong id="""">350 руб./чел.</strong></p><p id="""">&nbsp;</p><p id="""">&nbsp;</p><p id=""""><strong id=""""><em id="""">Детские программы</em>:</strong></p><p id=""""><strong id="""">13.00 – Шагаем с Чайковским</strong>. Игровая программа.</p><p id="""">Напольная игра-ходилка «Шагаем с Чайковским» объединяет людей разных возрастов и поколений, которые отправляются в увлекательное путешествие с композитором. С собой можно взять хорошее настроение и желание весело провести досуг. Стоит только начать и остановиться невозможно! </p><p id="""">Стоимость – бесплатно.</p><p id=""""><strong id="""">&nbsp;</strong></p><p id=""""><strong id="""">13.00 – Открытка для П.И. Чайковского</strong>. Музейное занятие.</p><p id="""">Открытки – это и сувенир, и приятный знак внимания. Создав свою уникальную открытку, можно стать участником &nbsp;посткроссинга &nbsp;– мирового движения обмена открытками.</p><p id="""">Стоимость – <strong id="""">230 руб./чел.</strong></p><p id=""""><strong id="""">&nbsp;</strong></p><p id=""""><strong id="""">16.00 – Ландышевый бал</strong>. </p><p id="""">Программа музейного клуба исторического танца «Реверанс» – это роскошный, пышный бал, название которому дал любимый цветок Чайковского и стихотворение, написанное композитором:</p><p id="""">…О, ландыш, отчего так радуешь ты взоры?<br>Другие есть цветы, роскошней и пышней,<br>И ярче краски их, и веселей узоры, —<br>Но прелести в них нет таинственной твоей…</p><p id="""">&nbsp;</p><p id=""""><strong id="""">Предварительная запись на экскурсии и программы по телефонам</strong></p><p id=""""><strong id="""">+ 7(49624) 2-10-50 или &nbsp;+7(915) 110-43-38.</strong></p><p id="""">&nbsp;</p><p id="""">&nbsp;</p><h5 id="""">17.00 – Концерт</h5><h5 id="""">заслуженного артиста РФ Александра ГИНДИНА.</h5><p id="""">Стоимость– <strong id="""">1100/1200 руб</strong>.</p><p id="""">Билеты продаются в кассе и на сайте музея-заповедника. </p><p id="""">Доступнопо Пушкинской карте.</p><p id="""">‍</p>",https://uploads-ssl.webflow.com/63e507244eda1ee9bb4c7ccd/6452662d11ec1ad74843def7_%D1%81%D0%B8%D0%BC%D1%84%D0%BE%D0%BD%D0%B8%D1%8F%20%D0%B6%D0%B8%D0%B7%D0%BD%D1%8C.png,https://uploads-ssl.webflow.com/63e507244eda1ee9bb4c7ccd/645265dade5d0211ac30fec6_%D0%B4%D0%B5%D0%BD%D1%8C%20%D1%80%D0%BE%D0%B6%D0%B4%D0%B5%D0%BD%D0%B8%D1%8F.jpg,https://uploads-ssl.webflow.com/63e507244eda1ee9bb4c7ccd/64527c448226aaddc5d260d8_%D0%9F%D0%98%D0%A7.png,,,
8 МАРТА В МУЗЕЕ,8-marta-v-muzee,63e507244eda1e713c4c7d34,65e731f56befd93d34ef947d,Tue Mar 05 2024 14:53:41 GMT+0000 (Coordinated Universal Time),Sat Mar 09 2024 15:52:52 GMT+0000 (Coordinated Universal Time),Sat Mar 09 2024 15:52:52 GMT+0000 (Coordinated Universal Time),8 марта,false,,"<h5 id="""">Выставка «Музыкальные сказки» (бесплатно) в течение дня</h5><h4 id="""">Сказка с давних времен сопровождает жизнь человека. Когда же она появилась? Проанализировав массу данных, ученые пришли к выводу, что самая древняя сказка – «Кузнец и Дьявол» - появилась около шести тысяч лет назад, еще в бронзовом веке. Разные народы имеют сказки со схожим сюжетом, что говорит о едином источнике их происхождения. Мы привыкли думать, что сказки предназначены только для детей. В действительности их аудитория не имеет возрастных границ, так как через метафору сказка передает мудрость поколений и позволяет задуматься о самых серьезных вещах и явлениях.</h4><h4 id="""">А как сказка сочетается с музыкой? В древние времена исполнение сказки могло сопровождаться различными звуками, а древние сказители ее и вовсе распевали. Однако, этим взаимодействие сказки и музыки не ограничивается. Многие известные композиторы, уважаемые и серьезные, так или иначе обращались в своем творчестве к иллюстрации сказок.</h4><h4 id="""">Кто-то создавал произведения для музыкального театра на сказочные сюжеты, как, например, Михаил Глинка, Николай Римский-Корсаков или Петр Ильич Чайковский. И, наверное, это был главный способ «оживить» сказку до изобретения кинематографа. Кто-то, уже в XX веке, писал музыку к кинофильмам и мультфильмам на сказочные темы, как Моисей Вайнберг, София Губайдулина или Родион Щедрин, с работами которых в том числе знакомит выставка.</h4><h4 id="""">Выставочный проект посвящен разным способам музыкального воплощения сказок. Он позволяет окунуться в сказочный мир детства. Ведь, как писал Антуан де Сент Экзюпери: «Все взрослые сначала были детьми, только мало кто из них об этом помнит».</h4><h4 id="""">Участники проекта: Государственный центральный музей кино, киностудия ""Союзмультфильм""</h4><p id="""">‍</p><h4 id=""""><em id="""">Количество билетов ограничено</em></h4><p id="""">‍</p><h5 id="""">Выставка «Константин Маковский. Портрет Александры Панаевой-Карцовой (бесплатно) в течение дня</h5><h4 id="""">«Константин Маковский. Портрет Александры Панаевой-Карцовой» — третья из цикла «выставок одного портрета», цель которого знакомить публику с картинами известных художников, запечатлевших тех, с кем Чайковский общался, сотрудничал, кто оставил заметный след в его биографии.</h4><h4 id="""">Портрет А. Панаевой-Карцовой выбран не случайно: певица была большой поклонницей творчества Чайковского, первой исполнительницей многих его романсов, а также партии Татьяны из оперы ""Евгений Онегин"" в музыкальном салоне Ю. Ф. Абазы в Санкт-Петербурге. Вскоре в Москве в Малом театре она познакомилась с самим композитором на премьере его оперы «Евгений Онегин», исполненной учащимися консерватории. С тех пор их дружеские отношения стали крепнуть, а в1884 году они породнились: певица вышла замуж за двоюродного племянника Петра Ильича, кавалергарда Георгия Павловича Карцова, который был моложе её на девять лет.</h4><h4 id="""">С художником Константином Маковским Александра Панаева-Карцова была хорошо знакома через свою близкую подругу, жену художника Юлию Леткову, с которой познакомилась весной 1876 года в Париже в доме Полины Виардо. Юлия обладала прекрасными вокальными данными и красивого тембра голосом (лирическое сопрано). Подруги часто общались и вместе пели.</h4><h4 id="""">Выставку дополняют и другие материалы из собрания Государственного мемориального музыкального музея-заповедника П. И. Чайковского. Среди них: фотографии Панаевой-Карцовой, ее письма к П. И. Чайковскому и его племяннику Ю. Л. Давыдову, фотография Петра Ильича с А. А. Жедринским, А. Н. Апухтиным и Г. П. Карцовым, а также акварельный портрет певицы в роли Татьяны художника Э. О. Визеля и авторская копия ее воспоминаний о композиторе.</h4><p id="""">‍</p><h4 id=""""><em id="""">Количество билетов ограничено</em></h4><h4 id="""">‍</h4><h5 id="""">&nbsp;Обзорная экскурсия по музею-заповеднику для сборных групп в 12.00</h5><h4 id="""">Экскурсия по мемориальному комплексу включает: </h4><h4 id="""">- посещение дома композитора, где полностью сохранилась подлинная обстановка 19 века (посетители услышат в записи звучание рояля П.И. Чайковского);</h4><h4 id="""">- прогулку по мемориальному парку с усадебными постройками;</h4><h4 id="""">- прослушивание аудиозаписей исполнения музыки Чайковского из коллекции фонофонда музея.</h4><p id="""">‍</p><h4 id="""">Стоимость:</h4><h4 id="""">1000 руб. взрослый</h4><h4 id="""">800 руб. льготный</h4><h4 id="""">350 руб. специальная цена</h4><p id="""">‍</p><h5 id="""">Обзорная экскурсия по мемориальному комплексу для сборных групп в 14.00</h5><h4 id="""">Экскурсия по музею-заповеднику включает: </h4><h4 id="""">- посещение дома композитора, где полностью сохранилась подлинная обстановка 19 века (посетители услышат в записи звучание рояля П.И. Чайковского);</h4><h4 id="""">- прогулку по мемориальному парку с усадебными постройками;</h4><h4 id="""">- выставки из фондов музея (серия временных экспозиций знакомит с коллекциями музея);</h4><h4 id="""">- прослушивание аудиозаписей исполнения музыки Чайковского из коллекции фонофонда музея.</h4><p id="""">‍</p><h4 id="""">Стоимость:</h4><h4 id="""">750 руб. взрослый</h4><h4 id="""">600 руб. льготный</h4><h4 id="""">350 руб. специальная цена</h4><p id="""">‍</p><h5 id="""">Лекция «Милые, любимые, дорогие» для сборных групп в 15.00</h5><h4 id="""">Посетителям расскажут о женщинах, окружавших Чайковского. Их фотографии и рукодельные подарки до сих пор можно увидеть в доме композитора. Рассказ будет дополнен чтением цитат из писем, демонстрацией увеличенных фотографий. Посетители не только смогут узнать, какую роль играли женщины в жизни Петра Ильича, но и смогут глубже понять судьбы женщин XIX века, чем они жили, что их волновало и радовало.</h4><p id="""">‍</p><h4 id="""">Стоимость (оплачивается только входной билет):</h4><h4 id="""">400 руб. взрослый</h4><h4 id="""">250 руб. льготный</h4><p id="""">‍</p><h5 id="""">Детская игровая программа «Мой милый ангел» в 15.00</h5><h4 id="""">«Мои ангелы... » –&nbsp;с этими словами обращался маленький &nbsp;Пётр Чайковский к своим родителям. Гости программы узнают, как&nbsp;воспитывались дети в&nbsp;семье Чайковских, какой образ матери навсегда остался в душе Петра Ильича, какие нежные письма писал будущий композитор домой. </h4><h4 id="""">Дети вспомнят, сколько домашних дел успевают переделать мамы и попробуют представить себя на их месте, выполняя самые разные задания. Интересные музыкальные загадки, весёлые конкурсы и игры, мультфильм –вместе будет интересно! Для самой любимой на свете мамы каждый сделает поздравительную открытку своими руками.</h4><p id="""">‍</p><h4 id="""">Стоимость:</h4><h4 id="""">250 руб. взрослый</h4><h4 id="""">230 руб. льготный</h4><h4 id="""">200 руб. специальная цена</h4><p id="""">‍</p><h5 id="""">Лекция &nbsp;по выставке «Константин Маковский. Портрет Александры Панаевой-Карцовой» в 16.00</h5><h4 id="""">Портрет Александры Панаевой-Карцовой – жемчужина коллекции фондов изобразительного искусства музея-заповедника П. И. Чайковского.</h4><h4 id="""">Ученица Полины Виардо в Париже, оперная и камерная певица, а впоследствии вокальный педагог была горячей поклонницей творчества Чайковского.</h4><h4 id="""">Александра Валериановна была не только музыкальным другом П. И. Чайковского, но и соединилась с его семьёй, выйдя замуж за двоюродного племянника композитора.</h4><p id="""">‍</p><h4 id="""">Стоимость (оплачивается только входной билет):</h4><h4 id="""">150 руб. взрослый</h4><h4 id="""">100 руб. льготный</h4><h4 id="""">‍</h4><h5 id="""">«Создаем красоту своими руками» в 13.00 и 16.00</h5><h4 id="""">Каждый унесёт с собой необычный подарок, сделанный своими руками.</h4><p id="""">‍</p><h4 id="""">Стоимость:</h4><h4 id="""">250 руб. взрослый</h4><h4 id="""">230 руб. льготный</h4><h4 id="""">200 руб. специальная цена</h4><p id="""">‍</p><p id="""">‍</p><p id="""">‍</p>",https://uploads-ssl.webflow.com/63e507244eda1ee9bb4c7ccd/65816086ca17847154634ce7_IMG_0325.jpg,,https://uploads-ssl.webflow.com/63e507244eda1ee9bb4c7ccd/65d46a3a2f558c0a22455e83_IMG_1477.jpg,,,
